{"schema_version":"herdr-task-acceptance/1.0","task_id":"TASK-002","subject_revision":{"type":"git","value":"def456"},"acceptance_results":[{"criterion_id":"AC-001","result":"UNVERIFIED","evidence_refs":[],"reason_code":"ENVIRONMENT_UNAVAILABLE","reason":"Device unavailable"}],"repair":{"current_round":0,"max_rounds":2,"status":"NOT_REQUIRED","finding_refs":[]},"regression":{"required":false,"scope":null,"result":"UNVERIFIED","evidence_refs":[],"reason_code":"NOT_EXECUTED","reason":null}}
