{"schema_version":"herdr-task-acceptance/1.0","task_id":"TASK-004","subject_revision":{"type":"git","value":"rep222"},"acceptance_results":[{"criterion_id":"AC-001","result":"FAIL","evidence_refs":["evidence://test/F1"],"reason_code":"ASSERTION_FAILED","reason":"Expected recovery did not occur"}],"repair":{"current_round":2,"max_rounds":2,"status":"EXHAUSTED","finding_refs":["FINDING-001"]},"regression":{"required":true,"scope":"FULL","result":"FAIL","evidence_refs":["evidence://test/R1"],"reason_code":"REGRESSION_FAILED","reason":null}}
