{"schema_version":"herdr-task-acceptance/1.0","task_id":"TASK-001","subject_revision":{"type":"git","value":"abc123"},"acceptance_results":[{"criterion_id":"AC-001","result":"PASS","evidence_refs":["evidence://test/T1"],"reason_code":null,"reason":null}],"repair":{"current_round":0,"max_rounds":2,"status":"NOT_REQUIRED","finding_refs":[]},"regression":{"required":false,"scope":null,"result":"UNVERIFIED","evidence_refs":[],"reason_code":"NOT_EXECUTED","reason":null}}
